{"dependencyArtifacts":[{"cacheKey":"sha256/05fcd57d7586cd0fce34a6e1d4ad1365a0c6f55b0aa321b204e623c9694667fd","sha256":"05fcd57d7586cd0fce34a6e1d4ad1365a0c6f55b0aa321b204e623c9694667fd","size":43}],"dependencyLock":{"path":"locks/omp/upstream/bun.lock","sha256":"9e9b8a2a931a4247c304a13709aa267922706faea80308243e77ca1bf71909e8"},"platform":"linux-x64","schemaVersion":1,"tools":[{"cacheKey":"sha256/80c02e454dead3d56860553ad34510045e9f0bc7850ccc07c4e9f0e019a3a988","name":"bun","sha256":"80c02e454dead3d56860553ad34510045e9f0bc7850ccc07c4e9f0e019a3a988","version":"1.4.0"}],"upstreamSource":{"archiveSha256":"2f5c38556a30a28322f7bb5f5762afda54b566cba57f2628b934419c9c998d34","commit":"9200553222915d89fd2acd655829dbaa806e9591"}}
